{
  "$schema": "http://json-schema.org/draft-07/schema#",
  "$id": "https://github.com/agent-rig/rig/rig.schema.json",
  "title": "Rig project profile",
  "description": "Per-project configuration read by rig skills at runtime. Lives at .rig/config.json in the consuming project. Every parameterizable skill reads this instead of hardcoding project specifics. Missing keys fall back to the documented defaults.",
  "type": "object",
  "additionalProperties": false,
  "properties": {
    "$schema": { "type": "string", "description": "Optional pointer to this schema for editor validation." },
    "project": {
      "type": "object",
      "description": "Identity of the consuming project.",
      "additionalProperties": false,
      "properties": {
        "name": { "type": "string", "description": "Human name of the project, e.g. \"Acme\"." },
        "repo": { "type": "string", "description": "GitHub owner/name, e.g. \"my-org/my-app\". Used by review/CI skills for gh api calls." }
      }
    },
    "runtime": {
      "type": "object",
      "description": "Language toolchain. Drives install/test/build command generation and CI setup steps.",
      "additionalProperties": false,
      "properties": {
        "packageManager": {
          "type": "string",
          "enum": ["bun", "pnpm", "npm", "yarn", "none"],
          "default": "npm",
          "description": "Also selects the CI setup action (setup-bun vs setup-node) and install command."
        },
        "installCommand": { "type": "string", "description": "Override the derived install command (default derived from packageManager, e.g. \"bun install\")." }
      }
    },
    "test": {
      "type": "object",
      "description": "How to run tests. Consumed by rig-debug, rig-tidy, rig-review, rig-worktree, rig-task, and the CI test-gate.",
      "additionalProperties": false,
      "properties": {
        "command": { "type": "string", "default": "npm test", "description": "Full unit-test suite command, e.g. \"bun run test\"." },
        "integrationCommand": { "type": "string", "description": "Integration-only command, if separate." },
        "e2eCommand": { "type": "string", "description": "End-to-end command, if any." },
        "requiresDatabase": { "type": "boolean", "default": false, "description": "If true, the CI test-gate provisions a throwaway Postgres service." }
      }
    },
    "sourceScope": {
      "type": "array",
      "items": { "type": "string" },
      "default": ["src"],
      "description": "Default path globs skills operate on when none is given, e.g. [\"packages/api/src\"]. rig-tidy/rig-spike/rig-sprint use the first entry as their default scope."
    },
    "vcs": {
      "type": "object",
      "description": "Branch and base-ref conventions. Consumed by rig-worktree, rig-task, rig-review, rig-sprint.",
      "additionalProperties": false,
      "properties": {
        "defaultBranch": { "type": "string", "default": "main", "description": "The trunk branch." },
        "baseRef": { "type": "string", "default": "origin/main", "description": "What rig-review diffs against and worktrees branch from." },
        "branchConvention": {
          "type": "string",
          "default": "{user}/{ticket}-{slug}",
          "description": "Template for new branch names. Placeholders: {user}, {ticket}, {slug}."
        },
        "protectedBranchMergeQueue": { "type": "boolean", "default": false, "description": "If true, flows use `gh pr merge --auto` and never pass --rebase/--squash (the queue's method wins)." }
      }
    },
    "tracker": {
      "type": "object",
      "description": "Issue tracker binding. Consumed by ticket, sprint, and implement-style flows. Set provider to \"none\" to strip all tracker steps.",
      "additionalProperties": false,
      "properties": {
        "provider": { "type": "string", "enum": ["linear", "github", "none"], "default": "none" },
        "team": { "type": "string", "description": "Linear team name/key (e.g. \"Engineering\") or GitHub org." },
        "project": { "type": "string", "description": "Linear project name (e.g. \"Acme\")." },
        "ticketPrefix": { "type": "string", "description": "Ticket identifier prefix, e.g. \"INC-\". Used to detect ticket IDs in branch names and PR titles." },
        "labelMapFile": { "type": "string", "default": ".claude/label-mapping.md", "description": "Path to the PR/tracker label source-of-truth doc." },
        "githubIntegration": { "type": "boolean", "default": false, "description": "If true, GitHub drives PR/merge transitions (In Progress on PR-open, In Review, Done on merge); skills set only the start-of-work In Progress, which GitHub can't observe before a PR exists." },
        "shapeLabels": {
          "type": "object",
          "additionalProperties": { "type": "string" },
          "description": "GitHub-only: labels applied at CREATION to mark a work item's shape, so a Project board / autonomous dispatcher can tell shapes apart (e.g. pick up only epic/sprint items from a Todo column; child feature issues are driven by their epic, not dispatched directly). rig-epic plan labels the parent with shapeLabels.epic; rig-sprint plan labels each item with shapeLabels.sprint. Linear needs no equivalent — its native parent/project grouping already distinguishes shapes. Omit the whole object to apply no shape labels.",
          "properties": {
            "epic": { "type": "string", "default": "epic", "description": "Label put on the epic parent issue by rig-epic plan (tracker: github)." },
            "sprint": { "type": "string", "default": "sprint", "description": "Label put on each independent sprint item by rig-sprint plan (tracker: github)." }
          }
        },
        "board": {
          "type": "object",
          "additionalProperties": false,
          "description": "GitHub Projects v2 board identity, consumed by the rig-tracker adapter (scripts/rig-tracker.sh) for select --status / set-status / add-to-project. IDENTITY ONLY — selection/movement POLICY lives in the adapter, which a project overrides at .rig/rig-tracker. Omit if you don't drive a board.",
          "properties": {
            "owner": { "type": "string", "description": "GitHub org/user that owns the Project (the <owner> in github.com/orgs/<owner>/projects/<n>)." },
            "projectNumber": { "type": "integer", "description": "ProjectV2 number (the <n> in /projects/<n>)." },
            "statusField": { "type": "string", "default": "Status", "description": "Name of the single-select field that represents the board column." },
            "statusOptions": {
              "type": "object",
              "additionalProperties": { "type": "string" },
              "description": "Map of rig's logical statuses to the board's display column names. The adapter resolves the underlying ProjectV2 option IDs at runtime, so put human names here — not node IDs.",
              "properties": {
                "todo": { "type": "string", "description": "Column an item sits in while dispatchable/unstarted (e.g. \"Todo\"). Used by select --dispatchable." },
                "inProgress": { "type": "string", "description": "Column for work in progress (e.g. \"In Progress\")." },
                "inReview": { "type": "string", "description": "Column for work in review (e.g. \"In Review\")." },
                "done": { "type": "string", "description": "Terminal column (e.g. \"Done\")." }
              }
            },
            "closingKeyword": { "type": "string", "default": "Closes", "description": "PR-body closing keyword the adapter's link-pr writes (\"Closes\" | \"Fixes\" | \"Resolves\") — links the issue and moves the board on merge via GitHub's built-in automation." }
          }
        }
      }
    },
    "review": {
      "type": "object",
      "description": "Code-review configuration. Consumed by rig-review (find and fix verbs).",
      "additionalProperties": false,
      "properties": {
        "patternsFile": { "type": "string", "default": ".claude/REVIEWER.md", "description": "Path to the project's P0–P3 review-pattern catalog." },
        "bot": { "type": "string", "enum": ["codex", "claude", "bugbot", "none"], "default": "none", "description": "Which PR review bot to poll/re-trigger in rig-review fix, if any." },
        "botRetrigger": { "type": "string", "description": "The comment string that re-triggers the bot, e.g. \"@codex review\"." },
        "maxRounds": { "type": "integer", "default": 5, "description": "Max fix<->re-review rounds before handing back to a human." }
      }
    },
    "style": {
      "type": "object",
      "description": "House style for the prose agents write (PR bodies, tickets, review findings, plans, hand-backs). Consumed by every persona and by the skills that emit written artifacts.",
      "additionalProperties": false,
      "properties": {
        "guideFile": { "type": "string", "default": ".claude/STYLE.md", "description": "Path to the project's writing-style guide. Rig ships a starter based on the Google developer documentation style guide." }
      }
    },
    "design": {
      "type": "object",
      "description": "Design-source binding. Consumed by rig-design. Set provider to \"none\" (default) to strip the design-to-ticket flow entirely.",
      "additionalProperties": false,
      "properties": {
        "provider": { "type": "string", "enum": ["figma", "none"], "default": "none" },
        "defaultFileKey": { "type": "string", "description": "Figma file key used when rig-design is invoked with a bare frame reference instead of a full URL." }
      }
    },
    "dev": {
      "type": "object",
      "description": "Local dev-stack commands for rig-preview (Step 6.5 of rig-task). Absent entirely -> rig-preview reports manual preview isn't set up and stops, rather than guessing commands. Each of dbCommand/backendCommand/seedCommand may be \"none\" (a real, common case, e.g. a client-only app with no backend) -- frontendCommand is the only one rig-preview requires to do anything.",
      "additionalProperties": false,
      "properties": {
        "dbCommand": { "type": "string", "default": "none", "description": "Command to start a local database, if any." },
        "backendCommand": { "type": "string", "default": "none", "description": "Command to start a backend/API server, if any." },
        "frontendCommand": { "type": "string", "description": "Command that serves the app (bundler/dev server). Required for rig-preview to do anything. MUST contain a literal \"{port}\" placeholder (e.g. \"npx expo start --port {port}\") -- rig-preview substitutes the actual port before running it. Without the placeholder, the command falls back to its own default port, which may collide with another worktree's preview even though the two picked different --port values." },
        "frontendPort": { "type": "integer", "default": 8081, "description": "Port frontendCommand binds. rig-preview refuses to reuse a port held by another live worktree's preview rather than killing it blind." },
        "mobileBuildCommand": { "type": "string", "description": "Mobile apps only: command that builds and installs a native binary onto a specific simulator device. MUST contain a literal \"{device}\" placeholder (e.g. \"npx expo run:ios --device {device}\"). rig-preview runs this for every preview -- a deep-link reconnect to an already-installed binary was tried and proven unreliable, so a full build+install per worktree is the default, not an optimization to skip." },
        "seedCommand": { "type": "string", "default": "none", "description": "Command to seed local data. Absent/none -> rig-preview reports this as a gap rather than inventing a seed script." }
      }
    },
    "agents": {
      "type": "object",
      "description": "Optional overrides mapping the kit's canonical agent roles to the agent names registered in this project. Defaults to the kit's own agents, rig-<role> (e.g. debugger->rig-debugger). Set a value only to point a role at a differently-named agent.",
      "additionalProperties": { "type": "string" },
      "properties": {
        "debugger": { "type": "string" },
        "reviewer": { "type": "string" },
        "architect": { "type": "string" },
        "qa": { "type": "string" },
        "coder": { "type": "string" },
        "designer": { "type": "string" }
      }
    },
    "ci": {
      "type": "object",
      "description": "CI-template parameters. Only relevant if you installed workflows from ci/. Each installed workflow documents which of these it reads.",
      "additionalProperties": false,
      "properties": {
        "imageRegistry": { "type": "string", "default": "ghcr.io", "description": "Container registry for the generic image-build workflow." },
        "slackWebhookSecret": { "type": "string", "default": "SLACK_CI_WEBHOOK_URL", "description": "Secret name holding the CI Slack webhook, consumed by slack-notify." },
        "trustBoundaryPaths": {
          "type": "array",
          "items": { "type": "string" },
          "description": "Paths that trip the deeper security-scan gate (auth, secrets, tenancy, billing surfaces)."
        }
      }
    }
  }
}
