{
  "$schema": "./rig.schema.json",
  "project": {
    "name": "Acme",
    "repo": "acme-inc/acme"
  },
  "runtime": {
    "packageManager": "bun"
  },
  "test": {
    "command": "bun run test",
    "integrationCommand": "bun run test:integration",
    "e2eCommand": "bun run test:e2e",
    "requiresDatabase": true
  },
  "sourceScope": ["packages/api/src"],
  "vcs": {
    "defaultBranch": "main",
    "baseRef": "origin/main",
    "branchConvention": "{user}/{ticket}-{slug}",
    "protectedBranchMergeQueue": true
  },
  "tracker": {
    "provider": "linear",
    "team": "Engineering",
    "project": "Acme",
    "ticketPrefix": "ACME-",
    "labelMapFile": ".claude/label-mapping.md",
    "githubIntegration": true,
    "shapeLabels": { "epic": "epic", "sprint": "sprint" },
    "board": {
      "owner": "acme-inc",
      "projectNumber": 7,
      "statusField": "Status",
      "statusOptions": { "todo": "Todo", "inProgress": "In Progress", "inReview": "In Review", "done": "Done" },
      "closingKeyword": "Closes"
    }
  },
  "review": {
    "patternsFile": ".claude/REVIEWER.md",
    "bot": "codex",
    "botRetrigger": "@codex review",
    "maxRounds": 5
  },
  "style": {
    "guideFile": ".claude/STYLE.md"
  },
  "design": {
    "provider": "none"
  },
  "dev": {
    "backendCommand": "none",
    "dbCommand": "docker compose up -d postgres",
    "seedCommand": "bun run db:seed",
    "frontendCommand": "bun run dev -- --port {port}",
    "frontendPort": 3000
  },
  "agents": {
    "debugger": "rig-debugger",
    "reviewer": "rig-reviewer",
    "architect": "rig-architect",
    "qa": "rig-qa",
    "coder": "rig-coder",
    "designer": "rig-ui-ux-designer"
  },
  "ci": {
    "imageRegistry": "ghcr.io",
    "slackWebhookSecret": "SLACK_CI_WEBHOOK_URL",
    "trustBoundaryPaths": ["packages/api/src/auth", "packages/api/src/billing", "infra/"]
  }
}
